{
  "declarationVersion": "1.0.0",
  "projectId": "fixture-range-project",
  "adapterRoot": "coding-agent/adapters",
  "adapterSchemaVersion": "1.0.0",
  "core": {
    "id": "coding-agent-skills",
    "expectedVersion": "0.2.3",
    "versionPin": ">=0.2.2 <0.3.0"
  },
  "compatibleSkillIds": ["llm-drift-control"],
  "adapters": [
    {
      "id": "fixture-project-docs",
      "version": "1.0.0",
      "skillIds": ["llm-drift-control"]
    }
  ],
  "validationCommand": "node <shared-core>/scripts/validate-project-adapters.mjs <project-root>",
  "evidenceOutput": "validation-output/project-adapters.json",
  "approvalPolicyReference": "docs/coding-agent-approval-policy.md",
  "noSecrets": true
}
